{
  "aerobicLowMinutes": 60,
  "aerobicModerateMinutes": 120,
  "aerobicVigorousMinutes": 0,
  "bedtime": null,
  "birthMonth": 1,
  "birthYear": 1991,
  "heightCm": 170,
  "inputRevision": "test-64",
  "pregnancyStatus": "unknown",
  "referenceDate": "2026-09-09",
  "sex": "female",
  "strengthFrequencyUnit": "days",
  "strengthIntensity": "moderate",
  "strengthWeeklyCount": 4,
  "wakeTime": null,
  "weightKg": 64
}
